0,1,2,3,4,5,6,7
Rank: 224,Maokai,Tier: 5,Jungle,Win Rate: 48.53%,Pick Rate: 0.76%,Ban Rate: 0.13%,"Counters: Jax, Rammus, Morgana"
Rank: 225,Zyra,Tier: 5,Jungle,Win Rate: 48.44%,Pick Rate: 0.62%,Ban Rate: 0.47%,"Counters: Xin Zhao, Warwick, Amumu"
Rank: 226,Varus,Tier: 5,Bottom,Win Rate: 48.41%,Pick Rate: 5.73%,Ban Rate: 1.21%,"Counters: Seraphine, Brand, Twitch"
Rank: 227,Swain,Tier: 5,Support,Win Rate: 48.28%,Pick Rate: 1.30%,Ban Rate: 0.21%,"Counters: Zac, Janna, Yuumi"
Rank: 228,Sylas,Tier: 5,Jungle,Win Rate: 48.04%,Pick Rate: 2.04%,Ban Rate: 1.83%,"Counters: Gwen, Volibear, Naafiri"
Rank: 229,Corki,Tier: 5,Bottom,Win Rate: 47.78%,Pick Rate: 3.29%,Ban Rate: 5.40%,"Counters: Tristana, Brand, Jinx"
Rank: 230,Akali,Tier: 5,Top,Win Rate: 47.58%,Pick Rate: 1.99%,Ban Rate: 3.69%,"Counters: Ryze, Gragas, Urgot"
Rank: 231,Smolder,Tier: 5,Top,Win Rate: 47.34%,Pick Rate: 0.93%,Ban Rate: 0.21%,"Counters: Naafiri, Irelia, Olaf"
Rank: 232,Aphelios,Tier: 5,Bottom,Win Rate: 47.28%,Pick Rate: 5.10%,Ban Rate: 0.82%,"Counters: Nilah, Kog'Maw, Samira"
Rank: 233,Naafiri,Tier: 5,Jungle,Win Rate: 46.93%,Pick Rate: 1.00%,Ban Rate: 0.54%,"Counters: Xin Zhao, Wukong, Fiddlesticks"
Rank: 234,Ashe,Tier: 5,Support,Win Rate: 46.84%,Pick Rate: 2.04%,Ban Rate: 2.39%,"Counters: Tahm Kench, Amumu, Poppy"
Rank: 235,Smolder,Tier: 5,Middle,Win Rate: 46.67%,Pick Rate: 0.58%,Ban Rate: 0.13%,"Counters: Qiyana, Talon, Zoe"
Rank: 236,Azir,Tier: 5,Middle,Win Rate: 46.57%,Pick Rate: 2.32%,Ban Rate: 0.38%,"Counters: Rumble, Quinn, Vel'Koz"
Rank: 237,K'Sante,Tier: 5,Top,Win Rate: 46.51%,Pick Rate: 4.04%,Ban Rate: 2.05%,"Counters: Yorick, Smolder, Zed"
Rank: 238,Hwei,Tier: 5,Support,Win Rate: 46.38%,Pick Rate: 1.87%,Ban Rate: 3.40%,"Counters: LeBlanc, Amumu, Bard"
Rank: 239,Corki,Tier: 5,Middle,Win Rate: 45.80%,Pick Rate: 2.65%,Ban Rate: 4.31%,"Counters: Rumble, Kayle, Nasus"
